job_posting_id,title,job_description,location,company_id,views,formatted_work_type,applies,original_listed_time,remote_allowed,job_posting_url,application_url,application_type,expiry,closed_time,formatted_experience_level,skills_desc,listed_time,posting_domain,sponsored,work_type
266566927,Marketing & Office Coordinator,"About Revesco Properties:Revesco Properties is a boutique commercial real estate investment, development, and management firm headquartered in Denver, CO. Revesco operates under three primary business units: Revesco Properties, Revesco Properties Trust and Elitch Gardens/The River Mile Development. Revesco Properties specializes in finding unique, urban-infill development sites in Denver to build projects that are accretive to the neighborhoods by utilizing interesting architectural elements and adding amenities such as retail. Revesco Properties Trust is a real estate investment trust that is focused on raising Canadian equity to acquire ownership in open-air shopping centers and mixed-use properties in select U.S. markets. And, The River Mile is a 62-acre urban-infill redevelopment at scale in the heart of downtown Denver in the current location of Elitch Gardens, along the banks of the South Platte River.
Position Summary: Revesco Properties is looking for an experienced and versatile Marketing and Office Coordinator who is eager to excel in all aspects of the job. The ideal candidate has experience in developing, creating, and executing marketing campaigns while managing a variety of other tasks in an office environment. The coordinator should be equally proficient with day-to-day marketing activities and long-term strategizing and strive under tight deadlines to meet the company's changing needs. The coordinator has a no-task-is-too-small, team-player attitude who is an expert at creative problem-solving. 
Marketing Responsibilities:
Marketing Strategies: Formulate and execute marketing plans and strategies aligned with the company's objectives and target audience. Brand Management: Maintain and enhance the company's brand image. Ensure brand consistency across all marketing channels and campaigns.Campaign Planning and Execution: Plan, coordinate, and execute marketing campaigns across various channels such as digital, print, social media, and events.Content Strategy: Develop content strategies for different marketing channels, including website, social media, email marketing, and advertising.Sales Collateral: Create and maintain sales collateral such as brochures, product sheets, presentations, etc. to support the Business Development team and drive customer engagement.Marketing Event Management: Collaborate with non-profit partners to plan and coordinate various events and volunteer opportunities.Analytics and Reporting: Track and analyze marketing performance metrics. Measure the effectiveness of marketing campaigns and initiatives to build successful strategies.Marketing Calendar: Maintain and update the marketing calendar, ensuring alignment with business objectives, monitoring deadlines, and communicating updates to VP of Ops and Strategy.CRM Software: Updating, maintaining and utilizing customer relationship management software (currently HubSpot) for marketing initiatives.
Office Responsibilities:
Event Planning: Assist in planning and organizing office events, and meetings. Coordinate logistics, such as venue booking, catering, and attendee arrangements.Office Management: Maintain office supplies inventory, order supplies as needed, and ensure office equipment is in working order. Coordinate with vendors and service providers for office maintenance and repairs.Continuous Improvement: Identify opportunities for process improvements and efficiency enhancements in office operations. Implement best practices and streamline workflows to optimize productivity.Ad Hoc Support: Provide additional support and assistance to employees and management as needed, demonstrating flexibility and adaptability in fulfilling job duties.
Qualifications: Bachelor’s degree in marketing, business, or related field.Minimum of two years of marketing/office coordinator experience. Equivalent education and experience may be substituted.Proficient in Adobe Creative Suite (InDesign, Illustrator, and Acrobat).Ability to work collaboratively with cross-functional teams.Advanced knowledge of Microsoft Office Suite.Strong organizational skills to manage multiple projects simultaneously, prioritize tasks, and meet deadlines.Creative thinking ability to develop engaging marketing campaigns and content that resonate with target audiences.Excellent business writing, editing and proofreading skills. Must communicate professionally, both orally and in writing.Experience using customer relationship management software, preferably HubSpot.Professional effectiveness and credibility.Notary certified or willingness to become certified. 
Work Environment and Physical Demands:This job operates in a professional office environment in the fun and upbeat LoHi neighborhood with Little Owl Coffee in the building. Participate in team events such as an annual summer boat day, ski trip, volunteer events, and weekly breakfast club! This role routinely uses standard office equipment such as computers, phones, photocopiers, filing cabinets, and scanners. Some travel may be required.
Compensation:$55,000-$75,000/year","Denver, CO",8577252.0,13.0,Full-time,1.0,1713458968000.0,0.0,https://www.linkedin.com/jobs/view/266566927/?trk=jobs_biz_prem_srch,,SimpleOnsiteApply,1716050968000.0,,,,1713458968000.0,,0,FULL_TIME
266825034,Software Support Specialist,"Are you driven by the thrill of solving problems and offering unparalleled support? Do you thrive in environments that challenge you and push you to grow? My client is at the forefront of Spectrum Engineering and Management, and are on the lookout for a dynamic Software Support Specialist to join their team.
If you are goal-oriented, crave new experiences, and are ready to make a tangible impact, I'd love to speak with you.
Duties include, but are not limited to:
Responsibilities:Assist users in designing and optimizing their wireless networks.Support Web Application users by identifying issues and testing updates and fixes.Conduct online support sessions.Support Request for Information (RFI)/Request for Proposal (RFP) efforts.Assist in sales initiatives and business development efforts.
Required Skills:Excellent computer skills.Strong verbal and written communication skills.Bachelor’s degree in science or engineering preferred.Experience of working in a Help Desk environment.Ability to work autonomously.Experience with PHP, JavaScript, and Web Development programming is desirable.Spanish/Portuguese language skills are a plus.
If you have a year or two's experience in a support role, or are a recent graduate, get in touch!","McLean, VA",99212509.0,,Full-time,0.0,1712859730000.0,0.0,https://www.linkedin.com/jobs/view/266825034/?trk=jobs_biz_prem_srch,,ComplexOnsiteApply,1728411708000.0,,,,1712859730000.0,,0,FULL_TIME
280496925,Coordinator for Multicultural Student Organizations,"The Coordinator serves as the principal advisor to the ASWSU Senate, committees, and functions associated. The ASWSU Advisor will be knowledgeable of procedures and practices pertaining to the ASWSU Constitution and By-laws as well as University procedures. The ASWSU Advisor’s duties will include but are not limited to challenging and supporting student leaders associated with the ASWSU Senate and affiliate committees and organizations, working with students to appropriate and reconcile the budgetary functions of the organizations. Additionally, the ASWSU Advisor will assist with program specifics for the programmatic and service committees of ASWSU, advising various committees and working to support advisors external to department staff.","Pullman, WA",166875.0,7.0,Full-time,0.0,1713455867000.0,0.0,https://www.linkedin.com/jobs/view/280496925/?trk=jobs_biz_prem_srch,https://wsu.wd5.myworkdayjobs.com/en-US/WSU_Jobs/job/Coordinator-for-Multicultural-Student-Organizations_R-11504?source=Linkedin,OffsiteApply,1716047867000.0,,,,1713455867000.0,,0,FULL_TIME
345332937,Barber,"Part time Barber, to start, tons of possibilities, including ownership, and or just working part time, and or picking up more hours in time. 
Experience preferred but will train the right person. All Haircuts, some shaving (will train). Scheduling clients. 
References needed.","Grafton, WI",9900162.0,3.0,Part-time,0.0,1713397018000.0,0.0,https://www.linkedin.com/jobs/view/345332937/?trk=jobs_biz_prem_srch,,ComplexOnsiteApply,1715989018000.0,,,,1713397018000.0,,0,PART_TIME
358267047,Production Planner (Food Technologist),"Job Summary: We are seeking a skilled Production Planner with a background in Food Technology to oversee our production processes and ensure efficient and effective manufacturing operations. The Production Planner will be responsible for ensuring the production schedule is optimized, materials are available when needed, and products are manufactured to meet customer demand. The successful candidate will work closely with Production Team, Procurement, and Quality Assurance Departments to ensure that production schedules are met, and product quality is maintained.  Production Planner will work onsite in Concord/Charlotte NC. Responsibilities: · Develop and maintain an effective production plan to ensure that production targets are met in a timely and cost-effective manner. · Confirm that the production schedule is aligned with customer demand and sales forecasts and communicate any changes to the relevant departments. · Monitor inventory levels and liaise with the procurement team to ensure that raw materials and packaging materials are available as and when required. · Analyze production data to identify opportunities for process improvement, reduce waste and improve product quality. · Coordinate with the maintenance and production supervisor to ensure that equipment is in good working order. · Confirm compliance with all relevant health and safety regulations and company policies. · Confirm that all production-related documentation is accurate and up to date. · Confirm all quality measures are met for production. Requirements: · Bachelor's degree in Food Science, Food Technology, or related field. · Minimum of 3-5 years of experience in a production planning or related role within the food industry. · Strong analytical, problem-solving skills and the ability to analyze production data to identify trends and opportunities for improvement. · Excellent communication and interpersonal skills, with the ability to work effectively with a range of stakeholders. · Knowledge of food safety regulations and quality control standards. · Familiarity with production planning software and tools (SAP, MRP, MPS….) · Strong organizational skills and the ability to manage multiple priorities simultaneously. · Understanding of production processes and supply chain management principles. · Ability to work independently and as part of a team. · Flexibility to work outside of regular business hours when required. Physical Capabilities · Ability to routinely carry and lift up to 50 lbs. · Frequent climbing, bending, reaching, stooping, kneeling, and stretching for extended periods of time. · Repeated lifting, carrying, pushing, pulling, and handling of products. · Extended standing or walking throughout the day. · Willing and able to operate powered industrial equipment including walkies, reach truck and stand ups. · Ability to use computer and telephones for extended periods of time. 
Salary: Depending on experience.Great Benefits Package with generous PTO","Concord, NC",348976.0,6.0,Full-time,1.0,1712350980000.0,0.0,https://www.linkedin.com/jobs/view/358267047/?trk=jobs_biz_prem_srch,,ComplexOnsiteApply,1714942980000.0,,,,1712350980000.0,,0,FULL_TIME
368586246,Embryologist,"Job duties:To recover oocytes from follicular aspirates, to prepare spermatozoa used to fertilize these oocytes using intracytoplasmic sperm injection (ICSI) technique, to culture the resulting embryos, to use micromanipulation to assist the embryos in hatching and to perform trophectoderm biopsy, and to assist the physician in transferring embryos. To maintain and prepare sufficient stocks of all materials needed in the IVF procedures. All of the above duties are accomplished in such a way as to maximize the pregnancy rate achieved at the practice.
Essential Job Functions include: Perform clinical in vitro fertilization techniques. This includes obtaining a semen specimen and preparing it for insemination, retrieving oocytes from follicular aspirates, inseminating the oocytes by intracytoplasmic injection, culturing the resulting embryos, and assisting in the transfer of the embryos.Perform assisted fertilization techniques, including assisted hatching and trophectoderm biopsy.Cryopreservation and thawing of oocytes, embryos and spermatozoa.Extensive record keeping, including but not limited to; recording all IVF related paper work and entering data into practice EMR, recording and filling laboratory checks and cleaning check lists, maintaining records on all equipment present in the laboratory.Prepare semen specimens for intrauterine inseminations; perform semen analyses.Ensure quality control and maintain chain of custodyConduct chemical analyses of body fluids such as blood and semen to determine presence of normal and abnormal components.Analyze test results and enters findings in computer.Perform quality control studies to ensure accuracy of clinical data.Engage in medical research under direction of Laboratory Director.Perform routine preventative maintenance on assigned instruments and equipment according to established schedule and procedure.Verify instrument functioning by checking and calibrating specific lab instruments and documents data.Record on instrument logs any repairs, replacement, and maintenance needed of equipment.Report test results in timely fashion.Establish and maintain effective working relationships with patients, medical, and administrative staff.Review results to assure total accuracyPrepare for federal and state inspections to maintain licensure for CLIA and/or CAP
Education and Experience: Bachelor's degree (B. S.) from four-year college or university in biology, laboratory science or related fieldThree to five years related laboratory experience and/or training; or equivalent combination of education and experienceAbility to access, input, and retrieve information from a computer. Experience with EMR systems Knowledge of Microsoft products (Word, Excel, Outlook)
Competencies: Professional demeanor and attitude; excellent interpersonal skills, and the ability to demonstrate good judgmentAbility to communicate accurately and concisely with patients while demonstrating compassion and understanding for their situationExcellent interpersonal skills and ability to communicate effectively, with coworkers and supervisorsAbility to remain calm in stressful situationsAbility to multi-task and remain flexible within a dynamic office environment.Ability to work as part of a team 
Benefits: Heath, Dental, Vision insurance 401(k)Paid time off Comp. Days for Weekends
Schedule: Monday to Friday and occasional weekends at one location 
To submit your application:https://www.indeed.com/job/embryologist-944f8c0533634448","St Louis, MO",81247311.0,2.0,Full-time,0.0,1713449250000.0,0.0,https://www.linkedin.com/jobs/view/368586246/?trk=jobs_biz_prem_srch,https://www.indeed.com/job/embryologist-944f8c0533634448,OffsiteApply,1716041250000.0,,,,1713449250000.0,,0,FULL_TIME
445337908,Chief Operating Officer,"The Chief Operations Officer (COO) position is an excellent opportunity for a highly motivated, mission-focused leader in operations. The COO is a key member of FBA’s management team, responsible for the effective functioning of FBA’s operations, including the warehouse, trucks and drivers, facilities, and equipment. This position is also responsible for all food resource activities.This is a full-time, exempt position which reports to the Chief Executive Officer, pay range $90,000 – $110,000 annually. To apply send resume and cover letter to jobs@foodbankofalaska.orgPlanning and ManagementKey member of leadership team, with responsibility for input on all major decisions for FBA’s future.Take an active role in strategic plan development and implementation.Take a visible role in FBA’s relationship with the Feeding America network for the purposes of improving operational effectiveness and food sharing.OperationsTake primary responsibility for the analysis, improvement, and implementation of all warehouse operations, including inventory, storage and distribution. Ensure that FBA implements best practices in warehousing.Take primary responsibility for all food transportation, including inbound food and shipping to rural Alaska.Ensure that donor and partner agencies are served promptly, efficiently, equitable, and courteously.Ensure that FBA’s facility and equipment are maintained appropriately, meeting all applicable regulations and codes. Develop plans pertaining to major repair, replacement or modification of facility systems and equipment.Establish, manage, and forecast expenditures and priorities on facilities and equipment and make recommendations for capital improvements.Food ResourcingTake primary responsibility for all incoming food to FBA, including food donations, USDA programs, and food purchases.Develop and maintain relationships with all local food donors, maintaining the highest standards of customer service. Actively seek new food donors. Ensure all food donors are recognized and thanked in a timely and appropriate manner.Conduct regular analysis of the food solicitation program and make recommendations for improvement.SupervisionDevelop, direct, and inspire operations staff.Ensure all activities are planned and completed in a timely and professional manner.Responsible for hiring, training, providing professional development opportunities and performance reviews for all operations staff.Here are some of the amazing benefits that come with this position:  A Premera Blue Cross Blue Shield Gold plan with very low employee costs.Principle Dental and Vision at a very low cost to employees. Free Life Insurance and AD&D. Paid time off, starting with 3 weeks accrued in the first year, increasing every year to 6 weeks. Approximately 13 paid holidays which include a full week in December. In addition, paid “snow days” when weather conditions force workplace closures.A 403b retirement plan with an employer match. Hybrid/ flexible schedule opportunities.A Wellness Reimbursement Plan. An outstanding team and work environment. Administrative offices are pet friendly. Regular fun events for staff with contests, prizes, and food. A shared leave bank to cover employees when they have emergencies and have exhausted their personal leave.","Anchorage, AK",8849197.0,7.0,Full-time,0.0,1713553746000.0,0.0,https://www.linkedin.com/jobs/view/445337908/?trk=jobs_biz_prem_srch,,ComplexOnsiteApply,1716145746000.0,,,,1713553746000.0,,0,FULL_TIME
606178500,Associate Attorney,"Big Island firm seeks associate ready for a change Our Kailua-Kona firm has a fantastic opportunity for a civil litigation associate interested in the full scope of litigation. Want to see your career grow and be mentored to handle all aspects of litigation? Want to have reasonable billable hours and be encouraged to enjoy a healthy work/life balance? Want the flexibility to expand your areas of practice, to earn a competitive salary, and a clear line to bonus opportunities? Are you ready to leave your big law firm, your government job, your solo practice, or just get started? Jung & Vassar, P.C. is a well-established Big Island civil litigation firm handling all aspects of litigation and we’re looking for an interested associate ready to join us in our Kona office. About you: You are in good standing and currently licensed to practice law in the State of Hawaiʻi. You have civil litigation experience or you’re ready to learn. You are stable, drama-free, and know what makes you happy. You understand at all times the need to be respectful toward the judiciary, judges and staff. We like what we do, and think you should too.Interested? Send resume to: davidadmin@jungvassar.com","Kailua-Kona, HI",53812339.0,3.0,Full-time,0.0,1712440648000.0,0.0,https://www.linkedin.com/jobs/view/606178500/?trk=jobs_biz_prem_srch,,ComplexOnsiteApply,1715032648000.0,,,,1712440648000.0,,0,FULL_TIME
634823509,HVAC Technician,"Service and installation of HVAC equipment, rooftop units, VRF sustems, PTAC units, duct installation. ductless mini split , control wiring ,VFD set up , piping ,brazing , blue prints ,communication and team work .","Brooklyn, NY",,2.0,Full-time,0.0,1713492045000.0,0.0,https://www.linkedin.com/jobs/view/634823509/?trk=jobs_biz_prem_srch,,ComplexOnsiteApply,1716084045000.0,,,,1713492045000.0,,0,FULL_TIME
