job_posting_id,title,job_description,location,company_id,views,formatted_work_type,applies,original_listed_time,remote_allowed,job_posting_url,application_url,application_type,expiry,closed_time,formatted_experience_level,skills_desc,listed_time,posting_domain,sponsored,work_type
2147609929,Production Planner,"Location: Hanover, PA

US Citizenship Required

About SKF: SKF has been making the world spin since 1907! SKF is an industry-leading manufacturer dedicated to a culture of belonging, where our people flourish in an equitable environment that promotes leadership development and career growth. SKF bearings played an integral role in helping Mars Rover collect rock and regolith samples on the planet’s surface.

As an SKF team member, you will join 40,000 colleagues from more than 130 countries developing bearing technology and services that make rotation more reliable and sustainable. Sustainability is at the heart of everything we do. SKF aims to have net zero greenhouse gas emissions at all our production facilities by 2030.

SKF products keep vehicles rolling, power the machines that put food on your table, and even reach into the cosmos as part of the Mars rover mission. Founded in Sweden in 1907, today SKF is publicly traded on the Nasdaq Stockholm with annual sales in 2020 of approximately $10 billion.

The Aerospace Business Unit is responsible for Aerospace applications with a global responsibility for Sales, Manufacturing, Business development, Product and Process Development. The Business Unit operates in a large number of countries and markets, all over the world and with a customer portfolio that includes all major players in the Aerospace industry. Our business is fully customer focused, with products specifically designed for an engine / airframe application and then produced in small quantities and small lots on highly flexible equipment. Extreme product range fragmentation, complex product design, very high-quality standards and traceability requirements are the peculiarity of our Business Unit. In Hanover, PA we produce Rings and Seals for the Aerospace and Industrial markets.

Job Summary:

This position will oversee the coordination and management of the day-to-day business activities between Aerospace Sealing Solutions’ customer service and the customer. The Planner is assigned a commodity for which they are responsible for the development and implementation of production and manufacturing schedules, to meet customer requirements and to maintain proper inventory levels. This will require constant interface with Operations, Engineering, Quality and Sales Departments. Based on already existing purchase contracts, the Planner will issue Purchase Orders for materials and supplies.The Planner will select the qualified supplier for each type of material required. The Planner is responsible and accountable for the performance of the suppliers of assigned commodities and the cost of purchased materials for the product line under their area of responsibility. Due to the nature of the work, US citizenship is required.

Job Duties and Responsibilities are (including but not limited to): Responsible for acting on order releases action and exception messages from the ERP system.Plans and manages production schedules to meet customer delivery requirements and best utilize the company’s productive capacity.Responsible for the analysis of sales order releases with respect to capacity planning and material requirements.Responsible for the management of inventory levels, schedules, and availability of selected item, either manufactured or purchased, to meet production schedules.Complete shipping information and delivery date input during Sale Order Reviews.Review and answer termination or cancellation requests from Sales.Order floor stock with shelf-life material for production.Review work in process material sweeps from production floor.Receive and review Sales Orders against current requirements and work in process using the Material Requirement Planning Report.Release Purchase Orders for production material, floor stock items, and all purchases to support the business unit.Interface with manufacturing personnel, the Purchasing Department and Supervisors on material status and production planning issues.

Job Requirements: Bachelor’s degree in business or equivalent manufacturing planning experienceC.P.I.M/C.P.M. certificate preferred.At least 2 yrs. experience in a Supply Chain role, specifically in requirements/production planning or master scheduling.Possess strong skills using MS Office programs, including Excel, Word, and PowerPoint.Experience with computerized manufacturing planning systems (MRP, ERP)Ability to prioritize and manage multiple tasks simultaneously.Due to the nature of the work, US citizenship is required.

What You’ll Love About SKF:Rest and Relaxation. Enjoy a generous PTO policy and 13 paid holidays.

Work/Life Integration. SKF supports work/life integration, home, family, community, personal well-being and health.

Diversity in the Workplace. At SKF, we strive to embed Diversity, Equity and Inclusion in everything we do. By developing a culture of belonging, our people can flourish; leading to an inclusive, equitable environment that promotes leadership, engagement and innovation.

Best in Class Benefits. SKF cares about the wellbeing of our employees. Comprehensive healthcare options to fit your needs and opt out payment. Added benefits include company paid life insurance, STD, LTD. Supplemental benefits include critical illness coverage, tuition reimbursement, employee discount programs, and much more!

Invest in your Future. Participate in our 401K program that boasts a 10% employer contribution: 100% match up to 5% of your elected contribution (100% Vested) plus an additional 5% company contribution.Reports to: Supply Chain ManagerLocation: Hanover, PAJob ID: 19588SKF provides equal employment [and affirmative action] opportunities to applicants and employees without regard to race, color, religion, sex, sexual orientation, gender identity, national origin, protected veteran status, or disability. PandoLogic. Keywords: Production Planner, Location: Hanover, PA - 17332","Hanover, PA",167757.0,2.0,Full-time,0.0,1712903593000.0,0.0,https://www.linkedin.com/jobs/view/2147609929/?trk=jobs_biz_prem_srch,https://yohskf.thejobnetwork.com/Job/592500987?etd=MUVP6CXQ22IN5IPWQNO5ITRZHO6KCNTSRHDXDXV4OQN46R63FAONK2TD7W5BQ3J6Y3UGFAT54GNNOWHKHHMU64UAA7KGKS4CF7HB6OR2MS3MSHFGNU5DJKQUJQULMXVL7XRST5JRASGKI%3d%3d%3d,OffsiteApply,1715496383000.0,,,,1712904383000.0,yohskf.thejobnetwork.com,0,FULL_TIME
2157930553,Customer Service Representative,"CUSTOMER SERVICE REPRESENTATIVE
We are looking for someone with a great attitude, a grateful demeanor, and a professional appearance that loves to help people. This is a unique opportunity to grow personally and professionally on a winning team with an incredible service-oriented culture. It is rare that we have an opening, so we are very selective in finding the right fit. No prior insurance experience is needed because we have a thorough training program to teach our way of serving our thousands of policies and clients.
The ideal candidate is someone who is forward thinking, driven, and coachable. The candidate must possess advanced computer and communication skills, and they must be able to work independently under pressure. We are very selective, so only those seriously committed to being a loyal team member of our extremely fast-paced, team-oriented, forward-thinking culture need to apply.
This position comes with a competitive base salary as well as bonus opportunities.If you do not like to be challenged or do not possess problem solving skills, then this opportunity will not be a good fit for you.
To apply - please send your resume and 2 business references to hiring@bradyinsgroup.com, you will receive an email back with next steps. 
Here’s what some of our employees have to say about their experiences with Brady Insurance Group.
“Working at Brady Insurance Group is truly a blessing. This team is so devoted to giving back to their community and providing clients with exceptional customer service and care. In my position as an administrative assistant, I am challenged to be creative and find solutions to complex problems. I stay very busy with projects intended to consistently improve the way we operate and provide support to my team. I never have a boring day here, that’s for sure! There is so much opportunity here for career as well as personal growth. If you are searching for a career that feels meaningful, I highly recommend Brady Insurance Group.” - Caitlin Laubsch
“I joined the Brady Insurance Group team because I was looking for a career full of opportunities to influence people in a positive way. I have been enabled to do so every single day in this job. As a customer service representative, I have grown a clientele that I care deeply about. I make sure they are fully informed about their policies and the market at large. I feel that this team treats clients like family.” - Evan Depew
“I have the pleasure of greeting clients when they come into the office. It is my favorite part of my job as a customer service representative. The training here was great, I have learned so much about insurance since being here. My biggest goal is always to make clients feel cared for and supported.” - Leslie Luckey","Kokomo, IN",19173111.0,3.0,Full-time,0.0,1713535002000.0,0.0,https://www.linkedin.com/jobs/view/2157930553/?trk=jobs_biz_prem_srch,,ComplexOnsiteApply,1716127002000.0,,,,1713535002000.0,,0,FULL_TIME
2195921577,Associate Planner,"Reports To: Director of Operations SUMMARY: The Associate Planner will be responsible for the operational planning according to demand requirements and inventory guidelines. You will be the one to ensure our goods are produced on time for distribution in a profitable manner. An excellent associate planner is versed in forecasting, operational led times, inventory administration, and ways to optimize them. They are organized and results-driven with good problem-solving skills. The goal is to ensure the smooth and cost-efficient flow of our operations.ESSENTIAL DUTIES AND RESPONSIBILITIES Coordinate planning of purchasing, production and inventories to meet actual and forecasted sales demand. Plan and prioritize operations to ensure maximum performance and minimum delay Determine manpower, equipment and raw materials needed to cover demand Monitor activities to ensure they will finish on time and within inventory objectives Address issues when they arise aiming for minimum disruption Obtain output information (number of finished products, percentage of defectives etc.) Prepare and submit status and performance reports Keep paperwork organized Collaborate with sales, quality control, finance, and other staff through the Fulfillment Coordinator
EDUCATION AND/OR EXPERIENCE High School Diploma: further education or certification preferred.  1 – 2 years related work experience in a planning or scheduling role within a manufacturing industry; or equivalent combination of education and experience. Good with math and statistics  Experience in scheduling with familiarity with material resource planning and inventory controls
PERFORMANCE ATTRIBUTES & COMPETENCIES:Leadership Vision & Strategic Thinking: Clear vision for the possible…thinks ahead about outcomes. Energy: Exhibits strong desire to achieve success. Problem-Solver: Objectively and logically recognizes and solves problems. Interpersonal & Teamwork Team Player: Reaches out to overcome walls; overcomes ""we-they"" relationships; approachable and earns respect for focus on ""company"" interests. Communication: Speaks confidently and effectively in one-on-one, team and public settings; writes clearly and concisely. Persuasive: Exhibits persuasiveness in change situations and effectively finds win-win solutions.Personal & Intellectual Integrity: Sets example; doesn't ethically cut corners; earns trust and respect. Intelligence: A ""quick study"" demonstrates ability to absorb new information rapidly. Leading-Edge: Constantly looking for best practice benchmarks.
LANGUAGE SKILLS The applicant must be able to read, write, and understand English fluently. Qualified candidates should be able to speak effectively to customers about company products and how they perform. The applicant must possess the ability to write routine reports and correspondences.
OTHER KNOWLEDGE, SKILLS AND ABILITIES Candidates must have a strong command of computer desktop tools such as MS Office (Excel, Word, PowerPoint, Outlook) to assist in completing essential duties. Effectively demonstrates strong written and verbal communication skills. ERP experience required, Syteline experience is preferred. 
JOB LOCATIONThis job requires a minimum of 60% of all work to be performed on site at the Robinson, Texas facility. Remote work is allowed provided the candidate has adequate home systems to support the high internet data demands required for this position. No travel allowance or expense reimbursement will be provided for due to any remote work due to this optional work place decision. 
QUALIFICATIONSTo perform this job successfully, an individual must be able to perform each essential duty satisfactorily. The requirements listed below are representative of the education, knowledge, skill, and/or ability required. Reasonable accommodations may be made to enable individuals with disabilities to perform the essential functions. 
PHYSICAL DEMANDSWhile performing the duties of this job, the person is occasionally required to stand, walk, sit, use hands to finger, reach with arms and hands, climb stairs, stoop, kneel, crouch, talk or hear. The person must occasionally lift and/or move up to 30lbs. The physical demands described here are representative of those that must be met by an Associate to successfully perform the essential functions of this job. The Associate should be able to see, hear and understand speech, communicate, lift computer equipment, supplies and materials, use office equipment and computers. If requested by an applicant or employee, we may provide reasonable accommodations to enable individuals with disabilities to perform the essential job functions. The above statements are intended to describe the general nature and level of work performed. They are not intended to be construed as an exhaustive list of all duties required of personnel so classified. We have the exclusive right to alter this job description at any time without notice.
WORK ENVIRONMENTWhile performing the duties of this job, the person is exposed to weather conditions prevalent at the time and an air-conditioned and heated office. The noise level is occasionally high.FreeFlight Systems is fully committed to Equal Employment Opportunity and to attracting, retaining, developing and promoting the most qualified employees without regard to their race, gender, color, religion, sexual orientation, national origin, age, physical or mental disability, citizenship status, veteran status, or any other characteristic prohibited by federal or state law. We are dedicated to providing a work environment free from discrimination and harassment, and where employees are treated with respect and dignity.
The above statements are intended to describe the general nature and level of work being performed. They are not intended to be construed as an exhaustive list of all responsibilities.","Waco, TX",,6.0,Full-time,0.0,1713391208000.0,0.0,https://www.linkedin.com/jobs/view/2195921577/?trk=jobs_biz_prem_srch,,ComplexOnsiteApply,1715983208000.0,,,,1713391208000.0,,0,FULL_TIME
2234533717,Full Stack Engineer,"Location: Remote
Company Overview:SkillFit, a subsidiary of Ideando Inc. is a cutting-edge AI-powered platform that revolutionizes the talent acquisition process by connecting job seekers with recruiters in a seamless and efficient manner. Our mission is to leverage technology to enhance the job search experience for both candidates and employers, ultimately driving better outcomes and reducing frustration in the hiring process.
Position Overview:We are seeking a talented and experienced Freelance Full-Stack Software Engineer to collaborate with our dynamic team on a project basis. The ideal candidate will have a passion for building innovative software solutions, a strong foundation in both front-end and back-end technologies, and a desire to contribute to a fast-paced startup environment.
Key Responsibilities:1. Collaborate with the product team to understand requirements, design solutions, and implement new features and functionalities for SkillFit's platform.2. Develop robust, scalable, and maintainable code across the full stack, including front-end UI components, back-end services, database integrations and API connectivity.3. Participate in code reviews, architectural discussions, and technical planning sessions to ensure code quality, performance, and adherence to best practices.4. Work closely with cross-functional teams, including product management, design, and QA, to deliver high-quality software solutions that meet user needs and business objectives.5. Identify and address technical challenges and opportunities for improvement, proposing innovative solutions and technologies to enhance the platform's capabilities and performance.6. Contribute to a collaborative and inclusive team culture, sharing knowledge, mentoring junior engineers, and actively participating in team meetings and discussions.
Qualifications:- 3+ years of professional experience in software development, with a focus on full-stack web development.- Proficiency in modern programming languages and frameworks, including JavaScript/TypeScript, React, Node.js, Python, and Express.js.- Experience with relational and NoSQL databases, such as PostgreSQL, MongoDB, or similar.- Strong understanding of web development fundamentals, including HTML5, CSS3, and responsive design principles.- Familiarity with cloud platforms and services, such as AWS, Azure, or Google Cloud Platform.- Knowledge of software engineering best practices, including version control, testing, and continuous integration/continuous deployment (CI/CD) pipelines.- Excellent problem-solving skills, attention to detail, and ability to work independently or as part of a team in a fast-paced, agile environment.- Strong communication and collaboration skills, with the ability to effectively communicate technical concepts to non-technical stakeholders.
Benefits:- Competitive compensation based on project scope and duration.- Flexible remote work environment with opportunities for collaboration and networking.- Opportunities to work on exciting projects and contribute to innovative solutions in the talent acquisition industry.- Potential for long-term engagement and ongoing project work based on performance and fit.- Professional development opportunities and support for continued learning and skill development.
Join us in our mission to transform the talent acquisition industry with innovative technology solutions. We highly encourage you to explore our beta product at https://skillfitai.com/ before submitting your application, allowing you to gain a deeper understanding of our mission and objectives. Become a Freelance Full-Stack Software Engineer at SkillFit and make a meaningful impact on the future of hiring!",United States,69611476.0,21.0,Full-time,6.0,1713493353000.0,1.0,https://www.linkedin.com/jobs/view/2234533717/?trk=jobs_biz_prem_srch,,ComplexOnsiteApply,1716085353000.0,,,,1713493353000.0,,0,FULL_TIME
2269442456,Computer Scientist,"Are you passionate about developing cutting-edge software for deep space communication and navigation systems? Are you ready to jumpstart your career and become a part of our core team?If so, we have an exciting opportunity for you! We are seeking a talented Computer Scientist on a voluntary (unpaid) basis to join our dynamic team and contribute to the creation of an innovative mobile application to support a NASA project.You will collaborate with a talented team of engineers, software developers, and product managers to turn the idea into feature-rich and secured software.",United States,99090758.0,,Volunteer,0.0,1713493919000.0,1.0,https://www.linkedin.com/jobs/view/2269442456/?trk=jobs_biz_prem_srch,https://www.navxcom.com/jobs/computer-scientist-10,OffsiteApply,1716085919000.0,,,,1713493919000.0,,0,VOLUNTEER
2314566469,Front end specialist,"Regional law firm looking for a candidate with uncommon initiative, drive, and customer service skills. This is a client facing role, which means you will be representing us to our clients. We take that seriously and expect you to. Ideal candidates will have superior phone sales experience, passion for closing sales, strong interpersonal skills, and quality work ethic. The position requires exceptional communication and organizational skills, ability to multitask, and attention to detail. This is a career position - it is demanding and fulfilling. Our work environment is fun but very fast paced. If you are looking for a position where you will have time to use your cell phone on the clock, this isn't it. Average candidates need not apply, we are looking for exceptional.
**FAIR WARNING DISCLAIMER - IF CHOSEN FOR THIS ROLE, YOU WILL HAVE A 90 DAY TRIAL PERIOD. IF YOU ARE RETAINED AFTER THIS PERIOD, YOU WILL BE ELIGIBLE FOR THE PERFORMANCE INCENTIVES/ BENEFITS. WE DO NOT GUARANTEE THAT YOU WILL BE RETAINED FOR THE FULL 90 DAYS IF YOU ARE NOT PERFORMING OR SUFFICIENTLY IMPROVING**
Responsibilities include:- Answering and managing incoming phone calls- Properly setting appointments on the appropriate calendar- Communicating with clients regarding case statuses- Greeting clients as they enter the office and serving refreshments- Communicating professionally with all parties who contact the firm-Maintaining notes and statuses based on your effortsBenefits available after 90 day trial include PTO, Health, Vision, Dental insurance, and other coverage. 401(k) with match available after first anniversary. Incentive pay based on performance.","Baton Rouge, LA",75865873.0,3.0,Full-time,0.0,1712889124000.0,0.0,https://www.linkedin.com/jobs/view/2314566469/?trk=jobs_biz_prem_srch,,ComplexOnsiteApply,1715481124000.0,,,,1712889124000.0,,0,FULL_TIME
2372177891,Client Service Associate,"As a non-licensed Client Services Assistant, you will be responsible for communicating effectively and professionally with clients and co-workers in person and through phone and email. It will require a high- volume and wide variety of administrative tasks, strong organizational skills and the ability to efficiently prioritize and multitask. Each non-licensed Client Services Assistant will be expected to develop a deep understanding of iWealth’s procedures and product offerings from a client services and regulatory compliance standpoint. Essential Duties & Responsibilities The Securities Exchange Commission (SEC) and the Securities Exchange Act of 1934 requires each employee to be fingerprinted and those fingerprints be processed as well as meeting enhanced financial fitness and criminal background standards prior to starting employment. As a non-licensed Client Services Assistant, your essential duties and responsibilities will be to assist the management team and the advisors in their daily duties including: ➢ Implement service consistent with the mission and values of iWealth➢ Working directly with clients and prospects to prepare and complete any necessary paperwork for brokerage or insurance related transactions➢ Preparation of documents & presentation materials for client review meetings➢ Recap and follow up on results of client review meetings performing assigned action items➢ Keep current on all continuing education (CE) & compliance training requirements➢ Recording any manually tracked or electronic logs for compliance➢ Assisting in the maintenance of office metric tracking databases, spreadsheets, and graphs
 ➢ Providing accurate and appropriate information to callers/clients based on established service schedules➢ Scheduling of meetings and conference calls with clients and prospects to complete transactions➢ Updating client files for new and revised information➢ Maintenance of paperless and paper files per office standards and regulatory requirements➢ Preparing formal correspondence and proofreading outgoing documents➢ Completing research projects as assigned➢ Assisting in the preparation and maintenance of training materials and office procedure manuals➢ Using computer systems throughout entire work day for financial transactions and accessing client database systems, word processing and many other essential functions➢ Maintaining complete confidentiality of personal and professional information   Other Duties & Responsibilities➢ Fill in or assist the other Client Services Assistants as necessary➢ Greet clients and office visitors in a welcoming and professional manner consistent with iWealth procedures➢ Screen and route phone calls as necessary➢ Prepare conference room for meetings/cleans up after meetings➢ Opening and closing duties as described in the procedures manual➢ Perform other duties assigned or delegated by the management team and Advisors➢ Attend broker/dealer meetings when applicable to office role possibly requiring overnight travel➢ Assist in the coordination of office events both on-site and at other venues: Lunch-n-Learn, client appreciation events and seminars etc.➢ Be available for scheduled marketing activities such as after-hours client events","Waseca, MN",1051897.0,2.0,Full-time,0.0,1713565528000.0,0.0,https://www.linkedin.com/jobs/view/2372177891/?trk=jobs_biz_prem_srch,,ComplexOnsiteApply,1716157528000.0,,,,1713565528000.0,,0,FULL_TIME
